product_id,product_name,review_title,review_body,Score,sentiment,review_date,
FK445,Samsung Galaxy A55,Good Mid-Range,Smooth performance and decent camera. Worth it!,4,positive,10-05-2025,
FK446,Philips Induction Cooktop,Fast Cooking,Heats up quickly and is easy to clean. Great buy!,5,positive,18-06-2025,
FK447,Fastrack Backpack,Spacious and Stylish,Perfect for college. Durable and looks great!,5,positive,12-07-2025,
FK448,LG Air Conditioner,Cools Efficiently,Very quiet and cools the room fast. Love it!,5,positive,08-08-2025,
FK449,Boat Smartwatch,Good Features,Tracks fitness well and looks stylish. Great value!,5,positive,19-01-2025,
FK450,Nike Sneakers,Perfect for Running,Lightweight and comfortable. Great for long runs!,5,positive,14-02-2025,
FK451,OnePlus 12R,Flagship Performance,Amazing speed and display. Best phone ever!,5,positive,10-03-2025,
FK452,Philips Hair Straightener,Works Perfectly,Straightens hair smoothly. Easy to use!,5,positive,15-04-2025,
FK453,Samsung Galaxy M34,Good Battery Life,"The battery lasts long, and the phone is smooth.",4,positive,09-05-2025,
FK454,Fastrack Bag,Durable and Spacious,Perfect for travel. Stylish and sturdy!,5,positive,20-06-2025,
FK455,L’Oreal Lip Gloss,Shiny and Long-Lasting,Looks great and stays on for hours. Love it!,5,positive,15-07-2025,
FK456,Asus ROG Phone 8,Great for Gaming,Fast and powerful. Perfect for mobile gaming!,5,positive,04-08-2025,
FK457,Puma Joggers,Comfortable and Stylish,Great for casual wear. Love the fit!,5,positive,27-01-2025,
FK458,LG Refrigerator,Spacious and Quiet,Cools well and has lots of space. Great buy!,5,positive,16-02-2025,
FK459,Boat Airdopes 211,Good Sound Quality,Great audio for budget earbuds. Comfortable!,4,positive,12-03-2025,
FK460,Samsung Soundbar,Amazing Audio,Perfect for home theater. Loud and clear!,5,positive,18-04-2025,
FK461,Nike Cap,Stylish and Comfy,Looks great and fits well. Perfect for casual wear!,5,positive,10-05-2025,
FK462,OnePlus Nord 4,Smooth and Fast,Great performance and display. Happy with it!,5,positive,15-06-2025,
FK463,Philips Toaster,,,,,,
